{"assets":{"bun":{"kind":"file","path":"bun","sha256":"a4470fa32b71af99ff5f96e7b114ee2e8b7973b2c3862a46d327c4282e5d07e0"},"compiler":{"kind":"file","path":"compiler","sha256":"7eeff71d7a6b2bece24fec60131d4bb78f974fa77898584bbf4d79ee1bc675e9"},"guard_prefix":{"kind":"guard-prefix","path":"guard_prefix","sha256":"aaaaaaaaaaaaaaaaaaaaaaaaaaaaaaaaaaaaaaaaaaaaaaaaaaaaaaaaaaaaaaaa"},"model_manifest":{"kind":"file","path":"model_manifest","sha256":"ec3b95cb9249c72dbb70bf1288d7591884e0d854d782b54334b1cbd2f6dfbc5a"},"native":{"kind":"file","path":"native","sha256":"cc7ffd8635899405bc188016ec36f38d3575543543184176ef1470268667f188"},"node":{"kind":"file","path":"node","sha256":"02239f8f83210bdb2000507e9b10afbd5bfccc5eaafa2fbf6d8efed6c8646af2"},"policy":{"kind":"file","path":"policy","sha256":"dc856efd695d347da7d3743b1f746225fb7f079530bc0a4359dcc69bde0b271e"},"private_cell":{"kind":"cell-artifacts","path":"cell","sha256":"4444444444444444444444444444444444444444444444444444444444444444"},"provider_manifest":{"kind":"file","path":"provider_manifest","sha256":"f4a4096492cb1ba01f7680736f360ec0f95e1a229434fadc146d4e8317bf9c40"},"sdk":{"kind":"sdk-tree","path":"sdk","sha256":"aaaaaaaaaaaaaaaaaaaaaaaaaaaaaaaaaaaaaaaaaaaaaaaaaaaaaaaaaaaaaaaa"},"wheel":{"kind":"file","path":"wheel","sha256":"3ee2ef00309373b289264af75e992dcaa6bf8d48a32b32f26ce1f794f341dc98"}},"campaign":{"path":"campaign.json","sha256":"d5d5d500299294c77ef7b6137cb60d31e5ba4113ddc369f6eabc5b68425b8f46"},"id":"inert-test","policy":{"path":"policy.json","sha256":"0065759cc0194d4849e0693c8c861d0f6536fb5a816187d4cfd68e97274781ff"},"provider":{"adapter_sha256":"eeeeeeeeeeeeeeeeeeeeeeeeeeeeeeeeeeeeeeeeeeeeeeeeeeeeeeeeeeeeeeee","binding_sha256":"dddddddddddddddddddddddddddddddddddddddddddddddddddddddddddddddd","maximum_requests":10000,"model_identity_digest":"cccccccccccccccccccccccccccccccccccccccccccccccccccccccccccccccc","profile":"owned-mlx-serial.v1","quota_config_digest":"bbbbbbbbbbbbbbbbbbbbbbbbbbbbbbbbbbbbbbbbbbbbbbbbbbbbbbbbbbbbbbbb","server_sha256":"ffffffffffffffffffffffffffffffffffffffffffffffffffffffffffffffff","token_cap":3000000},"runtime":{"base_url":"http://host.lima.internal:8002/v1","guard_bwrap_sha256":"2222222222222222222222222222222222222222222222222222222222222222","guard_executor_image_id":"sha256:3333333333333333333333333333333333333333333333333333333333333333","guard_source_sha":"1111111111111111111111111111111111111111","model_id":"inert-model","private_cell":{"cpu_profile":"single-core-v1","idmap_runtime":"ubuntu2404-controller-v1","initializer_sha256":"5555555555555555555555555555555555555555555555555555555555555555","native_sha256":"cc7ffd8635899405bc188016ec36f38d3575543543184176ef1470268667f188","runtime_tree_digest":"6666666666666666666666666666666666666666666666666666666666666666"}},"schema":"gauntlet-ci-runner.v2","selection":["episode-ca22355fcd7d7ebe2d85f303e535a570","episode-34c057d987c5d48b1fec3363d32fec89"],"shards":2}
